[
  {
    "id": "SDC-0001",
    "scenario_type": "question",
    "persona": "researcher_evaluator",
    "analytical_lenses": [
      "cohorting"
    ],
    "tier": "A",
    "job_to_be_done": "build a reproducible inclusion cohort",
    "surface_question": "Which {ORGANISATION} records have a current {SCHEME} designation as of {DATE}?",
    "semantic_contract": {
      "parameter_slots": {
        "ORGANISATION": "ORGANISATION",
        "SCHEME": "SCHEME",
        "DATE": "DATE"
      },
      "required_subject_scope_types": [
        "legal entity and designation scope"
      ],
      "required_proposition_families": [
        "identifier",
        "designation"
      ],
      "analytical_operations": [
        "filter",
        "audit"
      ],
      "required_joins": [
        "entity-to-designation"
      ],
      "temporal_compatibility": "as-of date",
      "freshness": "state review date",
      "evidence_standard": "authority-scoped designation evidence",
      "expected_output_shape": "cohort with evidence state",
      "forbidden_non_inferences": [
        "designation proves legal restriction or service quality"
      ]
    },
    "primary_domains": [
      19
    ],
    "supporting_domains": [
      1,
      20
    ],
    "answerability": [
      "supported",
      "bounded_partial",
      "tested_missingness",
      "unresolved"
    ],
    "adversarial": false,
    "semantic_signature": "{\"evidence\":\"authority-scoped designation evidence\",\"forbidden\":[\"designation proves legal restriction or service quality\"],\"intent\":\"build a reproducible inclusion cohort\",\"joins\":[\"entity-to-designation\"],\"operations\":[\"audit\",\"filter\"],\"propositions\":[\"designation\",\"identifier\"],\"subjects\":[\"legal entity and designation scope\"],\"temporal\":\"as-of date\"}",
    "distinctiveness_rationale": "Atomic identity/classification inclusion."
  },
  {
    "id": "SDC-0002",
    "scenario_type": "question",
    "persona": "charity_insider_adviser",
    "analytical_lenses": [
      "discovery"
    ],
    "tier": "A",
    "job_to_be_done": "build a reproducible inclusion cohort",
    "surface_question": "Which {ORGANISATION} have an evidenced purpose concerning {CAUSE} for {POPULATION}?",
    "semantic_contract": {
      "parameter_slots": {
        "ORGANISATION": "ORGANISATION",
        "CAUSE": "CAUSE",
        "POPULATION": "POPULATION"
      },
      "required_subject_scope_types": [
        "organisation purpose and population role"
      ],
      "required_proposition_families": [
        "purpose",
        "population"
      ],
      "analytical_operations": [
        "filter"
      ],
      "required_joins": [
        "purpose-to-population"
      ],
      "temporal_compatibility": "source effective period",
      "freshness": "report review date",
      "evidence_standard": "attributed purpose or governed assignment",
      "expected_output_shape": "cohort with attribution",
      "forbidden_non_inferences": [
        "purpose proves current delivery"
      ]
    },
    "primary_domains": [
      2
    ],
    "supporting_domains": [
      5,
      19,
      20
    ],
    "answerability": [
      "supported",
      "bounded_partial",
      "tested_missingness",
      "unresolved"
    ],
    "adversarial": false,
    "semantic_signature": "{\"evidence\":\"attributed purpose or governed assignment\",\"forbidden\":[\"purpose proves current delivery\"],\"intent\":\"build a reproducible inclusion cohort\",\"joins\":[\"purpose-to-population\"],\"operations\":[\"filter\"],\"propositions\":[\"population\",\"purpose\"],\"subjects\":[\"organisation purpose and population role\"],\"temporal\":\"source effective period\"}",
    "distinctiveness_rationale": "Separates stated purpose from activity."
  },
  {
    "id": "SDC-0003",
    "scenario_type": "question",
    "persona": "consultant_service_system_planner",
    "analytical_lenses": [
      "service_system_mapping"
    ],
    "tier": "B",
    "job_to_be_done": "construct an evidenced service cohort",
    "surface_question": "Find {SERVICE} for {POPULATION} with delivery geography {GEOGRAPHY} during {PERIOD}.",
    "semantic_contract": {
      "parameter_slots": {
        "SERVICE": "SERVICE",
        "POPULATION": "POPULATION",
        "GEOGRAPHY": "GEOGRAPHY",
        "PERIOD": "PERIOD"
      },
      "required_subject_scope_types": [
        "service and delivery geography"
      ],
      "required_proposition_families": [
        "service",
        "eligibility",
        "geography"
      ],
      "analytical_operations": [
        "filter"
      ],
      "required_joins": [
        "service-to-population",
        "service-to-delivery geography"
      ],
      "temporal_compatibility": "service period",
      "freshness": "show availability/freshness state",
      "evidence_standard": "service-scoped evidence",
      "expected_output_shape": "service cohort map",
      "forbidden_non_inferences": [
        "headquarters equals delivery geography"
      ]
    },
    "primary_domains": [
      3,
      5
    ],
    "supporting_domains": [
      7,
      19,
      20
    ],
    "answerability": [
      "supported",
      "bounded_partial",
      "tested_missingness",
      "unresolved"
    ],
    "adversarial": true,
    "semantic_signature": "{\"evidence\":\"service-scoped evidence\",\"forbidden\":[\"headquarters equals delivery geography\"],\"intent\":\"construct an evidenced service cohort\",\"joins\":[\"service-to-delivery geography\",\"service-to-population\"],\"operations\":[\"filter\"],\"propositions\":[\"eligibility\",\"geography\",\"service\"],\"subjects\":[\"service and delivery geography\"],\"temporal\":\"service period\"}",
    "distinctiveness_rationale": "Workflow cohort, not a tag union."
  },
  {
    "id": "SDC-0004",
    "scenario_type": "question",
    "persona": "consultant_service_system_planner",
    "analytical_lenses": [
      "service_system_mapping"
    ],
    "tier": "B",
    "job_to_be_done": "map supply-side access paths",
    "surface_question": "Map {SERVICE} access routes for {POPULATION} in {GEOGRAPHY} as of {DATE}.",
    "semantic_contract": {
      "parameter_slots": {
        "SERVICE": "SERVICE",
        "POPULATION": "POPULATION",
        "GEOGRAPHY": "GEOGRAPHY",
        "DATE": "DATE"
      },
      "required_subject_scope_types": [
        "service/site/channel access"
      ],
      "required_proposition_families": [
        "service",
        "access",
        "referral"
      ],
      "analytical_operations": [
        "map",
        "trace"
      ],
      "required_joins": [
        "service-to-site",
        "service-to-access condition",
        "service-to-referral relationship"
      ],
      "temporal_compatibility": "as-of date",
      "freshness": "currentness must be evidenced",
      "evidence_standard": "time-bound service/access observation",
      "expected_output_shape": "bounded supply map",
      "forbidden_non_inferences": [
        "listed service is currently available",
        "supply establishes unmet need"
      ]
    },
    "primary_domains": [
      3,
      7
    ],
    "supporting_domains": [
      5,
      12,
      20
    ],
    "answerability": [
      "supported",
      "bounded_partial",
      "tested_missingness",
      "unresolved"
    ],
    "adversarial": true,
    "semantic_signature": "{\"evidence\":\"time-bound service/access observation\",\"forbidden\":[\"listed service is currently available\",\"supply establishes unmet need\"],\"intent\":\"map supply-side access paths\",\"joins\":[\"service-to-access condition\",\"service-to-referral relationship\",\"service-to-site\"],\"operations\":[\"map\",\"trace\"],\"propositions\":[\"access\",\"referral\",\"service\"],\"subjects\":[\"service/site/channel access\"],\"temporal\":\"as-of date\"}",
    "distinctiveness_rationale": "Real planner workflow preserves supply/need boundary."
  },
  {
    "id": "SDC-0005",
    "scenario_type": "question",
    "persona": "public_donor_participant",
    "analytical_lenses": [
      "discovery"
    ],
    "tier": "A",
    "job_to_be_done": "inspect participation routes",
    "surface_question": "What {SERVICE} participation opportunities accept {POPULATION} with {THRESHOLD} commitment?",
    "semantic_contract": {
      "parameter_slots": {
        "SERVICE": "SERVICE",
        "POPULATION": "POPULATION",
        "THRESHOLD": "THRESHOLD"
      },
      "required_subject_scope_types": [
        "advertised opportunity"
      ],
      "required_proposition_families": [
        "opportunity",
        "eligibility",
        "time pattern"
      ],
      "analytical_operations": [
        "filter"
      ],
      "required_joins": [
        "opportunity-to-service"
      ],
      "temporal_compatibility": "advertised effective period",
      "freshness": "show review state",
      "evidence_standard": "opportunity evidence",
      "expected_output_shape": "opportunity list",
      "forbidden_non_inferences": [
        "advertisement proves enduring participation"
      ]
    },
    "primary_domains": [
      6
    ],
    "supporting_domains": [
      7,
      20
    ],
    "answerability": [
      "supported",
      "bounded_partial",
      "tested_missingness",
      "unresolved"
    ],
    "adversarial": false,
    "semantic_signature": "{\"evidence\":\"opportunity evidence\",\"forbidden\":[\"advertisement proves enduring participation\"],\"intent\":\"inspect participation routes\",\"joins\":[\"opportunity-to-service\"],\"operations\":[\"filter\"],\"propositions\":[\"eligibility\",\"opportunity\",\"time pattern\"],\"subjects\":[\"advertised opportunity\"],\"temporal\":\"advertised effective period\"}",
    "distinctiveness_rationale": "Participation is distinct from workforce and service use."
  },
  {
    "id": "SDC-0006",
    "scenario_type": "question",
    "persona": "consultant_service_system_planner",
    "analytical_lenses": [
      "service_system_mapping",
      "coverage"